title,description
Introduction to Python Programming,Learn basics of Python.
Machine Learning Fundamentals,Dive into supervised and unsupervised learning with scikit-learn.
Web Development with React,Build interactive UIs using React components and state management.
Data Science with Pandas,Analyze data using Pandas for cleaning.
Natural Language Processing,Explore tokenization.
Advanced Python Techniques,Master list comprehensions.
Deep Learning with TensorFlow,Build neural networks for image and text processing using TensorFlow.
Full-Stack Development with Django,Create robust web apps with Django and PostgreSQL.
Data Visualization with Plotly,Craft interactive charts and dashboards using Plotly.
Introduction to Cloud Computing,Understand AWS AZURE and GCP for scalable applications.